<?xml version="1.0" encoding="UTF-8"?>
<!DOCTYPE NCPReport SYSTEM "ncpreportf.dtd">
<NCPReport id="2850" languageofproduction="en" yearofproduction="2005">
	<Country faostatcode="129" iso3="MDG">
		<name>Madagascar</name>
		<longname>Madagascar</longname>
	</Country>
	<Theme id="2905" position="top" order="0" name="Nutrition Profile">
		<Textual id="2904" type="1" style="outlineelement" order="0" name="Location of Country">
			<dataset id="2903" type="2" style="ncpdataset" order="0" name="testData">
				<xml>
					<datasets>
						<country name="Madagascar"/>
						<layer heading="layer" name="Admin 1">
							<dataset datasetid="" heading="theme" name="Anthropometric surveys of preschool children" themeid="">
								<region heading="Region" layername="Admin 1" name="Antananarivo">
									<extent axis="2" heading="Source Name" name="EnquÃªte DÃ©mographique et de SantÃ© Madagascar 1997 (DDSS/INSTAT and Macro Int.Inc.">
										<extent axis="3" heading="Residence" name="unspecified">
											<extent axis="4" heading="Age" name="0 - 2.99">
												<extent axis="5" heading="Gender" name="M/F">
													<extent axis="6" heading="Mother's Education" name="unspecified">
														<extent axis="7" heading="Indicator" name="Stunting:Height-for-age &lt;-3 Z-scores">
															<year Publishyear="2005" name="1997" sample_defn_idx="2" sample_size="968" value="25.7"/>
														</extent>
														<extent axis="7" heading="Indicator" name="Stunting:Height-for-age&lt;-2 Z-scores*">
															<year Publishyear="2005" name="1997" sample_defn_idx="2" sample_size="968" value="57.0"/>
														</extent>
														<extent axis="7" heading="Indicator" name="Wasting:Weight-for-height&lt;-3 Z-scores">
															<year Publishyear="2005" name="1997" sample_defn_idx="2" sample_size="968" value="0.8"/>
														</extent>
														<extent axis="7" heading="Indicator" name="Wasting:Weight-for-height&lt;-2 Z-scores*">
															<year Publishyear="2005" name="1997" sample_defn_idx="2" sample_size="968" value="7.9"/>
														</extent>
														<extent axis="7" heading="Indicator" name="Underweight:Weight-for-age&lt;-3 Z-scores">
															<year Publishyear="2005" name="1997" sample_defn_idx="2" sample_size="968" value="15.1"/>
														</extent>
														<extent axis="7" heading="Indicator" name="Underweight:Weight-for-age&lt;-2 Z-scores*">
															<year Publishyear="2005" name="1997" sample_defn_idx="2" sample_size="968" value="43.8"/>
														</extent>
													</extent>
												</extent>
											</extent>
										</extent>
									</extent>
									<extent axis="2" heading="Source Name" name="EnquÃªte DÃ©mographique et de SantÃ© de Madagascar 2003-2004 (INSTAT et ORC Macro">
										<extent axis="3" heading="Residence" name="unspecified">
											<extent axis="4" heading="Age" name="0 - 2.99">
												<extent axis="5" heading="Gender" name="M/F">
													<extent axis="6" heading="Mother's Education" name="unspecified">
														<extent axis="7" heading="Indicator" name="Stunting:Height-for-age &lt;-3 Z-scores">
															<year Publishyear="2005" name="2003-2004" sample_defn_idx="9" sample_size="830" value="27.9"/>
														</extent>
														<extent axis="7" heading="Indicator" name="Stunting:Height-for-age&lt;-2 Z-scores*">
															<year Publishyear="2005" name="2003-2004" sample_defn_idx="9" sample_size="830" value="50.1"/>
														</extent>
														<extent axis="7" heading="Indicator" name="Wasting:Weight-for-height&lt;-3 Z-scores">
															<year Publishyear="2005" name="2003-2004" sample_defn_idx="9" sample_size="830" value="2.5"/>
														</extent>
														<extent axis="7" heading="Indicator" name="Wasting:Weight-for-height&lt;-2 Z-scores*">
															<year Publishyear="2005" name="2003-2004" sample_defn_idx="9" sample_size="830" value="12.2"/>
														</extent>
														<extent axis="7" heading="Indicator" name="Underweight:Weight-for-age&lt;-3 Z-scores">
															<year Publishyear="2005" name="2003-2004" sample_defn_idx="9" sample_size="830" value="11.1"/>
														</extent>
														<extent axis="7" heading="Indicator" name="Underweight:Weight-for-age&lt;-2 Z-scores*">
															<year Publishyear="2005" name="2003-2004" sample_defn_idx="9" sample_size="830" value="39.3"/>
														</extent>
													</extent>
												</extent>
											</extent>
										</extent>
									</extent>
									<extent axis="2" heading="Source Name" name="EnquÃªte nationale dÃ©mographique et sanitaire 1992. (Refeno G.">
										<extent axis="3" heading="Residence" name="unspecified">
											<extent axis="4" heading="Age" name="0 - 4.99">
												<extent axis="5" heading="Gender" name="M/F">
													<extent axis="6" heading="Mother's Education" name="unspecified">
														<extent axis="7" heading="Indicator" name="Stunting:Height-for-age &lt;-3 Z-scores">
															<year Publishyear="2005" name="1992" sample_defn_idx="7" sample_size="1273" value="27.8"/>
														</extent>
														<extent axis="7" heading="Indicator" name="Stunting:Height-for-age&lt;-2 Z-scores*">
															<year Publishyear="2005" name="1992" sample_defn_idx="7" sample_size="1273" value="61.4"/>
														</extent>
														<extent axis="7" heading="Indicator" name="Wasting:Weight-for-height&lt;-3 Z-scores">
															<year Publishyear="2005" name="1992" sample_defn_idx="7" sample_size="1273" value="0.1"/>
														</extent>
														<extent axis="7" heading="Indicator" name="Wasting:Weight-for-height&lt;-2 Z-scores*">
															<year Publishyear="2005" name="1992" sample_defn_idx="7" sample_size="1273" value="3.2"/>
														</extent>
														<extent axis="7" heading="Indicator" name="Underweight:Weight-for-age&lt;-3 Z-scores">
															<year Publishyear="2005" name="1992" sample_defn_idx="7" sample_size="1273" value="8.6"/>
														</extent>
														<extent axis="7" heading="Indicator" name="Underweight:Weight-for-age&lt;-2 Z-scores*">
															<year Publishyear="2005" name="1992" sample_defn_idx="7" sample_size="1273" value="44.7"/>
														</extent>
													</extent>
												</extent>
											</extent>
										</extent>
									</extent>
								</region>
								<region heading="Region" layername="Admin 1" name="Antsiranana">
									<extent axis="2" heading="Source Name" name="EnquÃªte DÃ©mographique et de SantÃ© Madagascar 1997 (DDSS/INSTAT and Macro Int.Inc.">
										<extent axis="3" heading="Residence" name="unspecified">
											<extent axis="4" heading="Age" name="0 - 2.99">
												<extent axis="5" heading="Gender" name="M/F">
													<extent axis="6" heading="Mother's Education" name="unspecified">
														<extent axis="7" heading="Indicator" name="Stunting:Height-for-age &lt;-3 Z-scores">
															<year Publishyear="2005" name="1997" sample_defn_idx="14" sample_size="211" value="15.0"/>
														</extent>
														<extent axis="7" heading="Indicator" name="Stunting:Height-for-age&lt;-2 Z-scores*">
															<year Publishyear="2005" name="1997" sample_defn_idx="14" sample_size="211" value="37.1"/>
														</extent>
														<extent axis="7" heading="Indicator" name="Wasting:Weight-for-height&lt;-3 Z-scores">
															<year Publishyear="2005" name="1997" sample_defn_idx="14" sample_size="211" value="0.6"/>
														</extent>
														<extent axis="7" heading="Indicator" name="Wasting:Weight-for-height&lt;-2 Z-scores*">
															<year Publishyear="2005" name="1997" sample_defn_idx="14" sample_size="211" value="4.2"/>
														</extent>
														<extent axis="7" heading="Indicator" name="Underweight:Weight-for-age&lt;-3 Z-scores">
															<year Publishyear="2005" name="1997" sample_defn_idx="14" sample_size="211" value="7.5"/>
														</extent>
														<extent axis="7" heading="Indicator" name="Underweight:Weight-for-age&lt;-2 Z-scores*">
															<year Publishyear="2005" name="1997" sample_defn_idx="14" sample_size="211" value="31.8"/>
														</extent>
													</extent>
												</extent>
											</extent>
										</extent>
									</extent>
									<extent axis="2" heading="Source Name" name="EnquÃªte DÃ©mographique et de SantÃ© de Madagascar 2003-2004 (INSTAT et ORC Macro">
										<extent axis="3" heading="Residence" name="unspecified">
											<extent axis="4" heading="Age" name="0 - 2.99">
												<extent axis="5" heading="Gender" name="M/F">
													<extent axis="6" heading="Mother's Education" name="unspecified">
														<extent axis="7" heading="Indicator" name="Stunting:Height-for-age &lt;-3 Z-scores">
															<year Publishyear="2005" name="2003-2004" sample_defn_idx="5" sample_size="214" value="14.3"/>
														</extent>
														<extent axis="7" heading="Indicator" name="Stunting:Height-for-age&lt;-2 Z-scores*">
															<year Publishyear="2005" name="2003-2004" sample_defn_idx="5" sample_size="214" value="31.5"/>
														</extent>
														<extent axis="7" heading="Indicator" name="Wasting:Weight-for-height&lt;-3 Z-scores">
															<year Publishyear="2005" name="2003-2004" sample_defn_idx="5" sample_size="214" value="1.8"/>
														</extent>
														<extent axis="7" heading="Indicator" name="Wasting:Weight-for-height&lt;-2 Z-scores*">
															<year Publishyear="2005" name="2003-2004" sample_defn_idx="5" sample_size="214" value="14.0"/>
														</extent>